num	safe_title	img	alt	link	news	year	month	day
2642	Meta-Alternating Current	meta_alternating_current.png	It's always bothered me that you can't cancel out an inverter by putting a second inverter after it.			2022	7	6
2643	Cosmologist Gift	cosmologist_gift.png	These neutrinos were freshly produced by a local source just 8 minutes ago			2022	7	8
2644	fMRI Billboard	fmri_billboard.png	[other side] If the first word of an instruction you're given starts with the same letter as your crush's name, for that step imagine the experimenter is your crush.			2022	7	11
2645	The Best Camera	the_best_camera.png	The best camera is the one at L2.			2022	7	13
2646	Minkowski Space	minkowski_space.png	My liege, we were able to follow the ship into Minkowski space, but now they've jumped to Hilbert space and they could honestly be anywhere.			2022	7	15
2647	Capri Suns	capri_suns.png	[As security is dragging me away] "Come on, at least I didn't make the mistake in the other direction!"			2022	7	18
2648	Chemicals	chemicals.png	It's hard to believe, but lots of kids these days ONLY know how to buy prepackaged molecules.			2022	7	20
2649	Physics Cost-Saving Tips	physics_cost_saving_tips.png	I got banned from the county fair for handing out Helium-2 balloons. Apparently the instant massive plasma explosions violated some local ordinance or something.			2022	7	22
2650	Deepfakes	deepfakes.png	If so great a deductive mind as Arthur Conan Doyle can be fooled by the Cottingley Deepfakes, what chance do we mortals have? Soon our very reality will be dictated by the whims of Frances (9) and Elsie (16).			2022	7	25
2651	Air Gap	air_gap.png	You can still do powerline networking, but the bitrate does drop a little depending on the lightbulb warmup and cooldown delay.			2022	7	27
2652	Proxy Variable	proxy_variable.png	Our work has produced great answers. Now someone just needs to figure out which questions they go with.			2022	7	29
2653	Omnitaur	omnitaur.png	"My parents were both omnitaurs, which is how I got interested in recombination," said the normal human.			2022	8	1
2654	Chemtrails	chemtrails.png	Ants have reverse chemtrails--regular citizens spraying chemicals everywhere they go to control the government.			2022	8	3
2655	Asking Scientists Questions	asking_scientists_questions.png	'Does the substance feel weird to the touch?' is equally likely to get the answers 'Don't be ridiculous, you would never put your hand near a sample. We have safety protocols.' and 'Yeah, and it tastes AWFUL.'	https://xkcd.com/what-if-2/		2022	8	5
2656	Scientific Field Prefixes	scientific_field_prefixes.png	Massage: Theoretical (10), Quantum (6), High-energy (2), Computational (1), Marine (1), Astro- (None)			2022	8	8
2657	Complex Vowels	complex_vowels.png	Pronouncing [ṡṡċċḣḣẇẇȧȧ] is easy; you just say it like the 'x' in 'fire'.			2022	8	10
2658	Coffee Cup Holes	coffee_cup_holes.png	Theoretical physicist: At the Planck length, uncountably many.			2022	8	12
2659	Unreliable Connection	unreliable_connection.png	NEGATIVE REVIEWS MENTION: Unreliable internet. POSITIVE REVIEWS MENTION: Unreliable internet.			2022	8	15
2660	Gen Z	gen_z.png	Curdled milk, of a peculiar kind, made after a Bulgarian recipe and called "yaghurt," is now a Parisian fad and is believed to be a remedy against growing old. A correspondent who has tried it, says he would prefer to die young. (1905, The Elk Falls Journal)			2022	8	17
2661	Age Milestone Privileges	age_milestone_privileges.png	If you reach 122, you get complete unrevertible editorial control over Jeanne Calment's Wikipedia article.			2022	8	19
2662	Physics Safety Tip	physics_safety_tip.png	In general, avoid exposure to any temperatures, pressures, particle energies, or states of matter that physicists think are neat.	https://xkcd.com/what-if-2/		2022	8	22
2663	Tetherball Configurations	tetherball_configurations.png	Ground-pole-ball-pole can be fun if you shake the first pole to get the second one whipping around dangerously, but the ball at the joint gets torn apart pretty fast.			2022	8	24
2664	Cloud Swirls	cloud_swirls.png	'Why did you get into fluid dynamics?' 'Well, SOME planet has to have the coolest clouds, odds are it's not ours, and rockets are slow.'			2022	8	26
2665	America Songs	america_songs.png	Juraaaassic Park, Juraaaassic Park, God shed his grace on theeeee			2022	8	29
2666	Universe Price Tiers	universe_price_tiers.png	In Universe Pro®™ the laws of physics remain unchanged under time reversal, to maintain backward compatibility.			2022	8	31
2667	First Internet Interaction	first_internet_interaction.png	To that stranger on the KOOL Tree House chat room, I gotta hand it to you: You were, ultimately, not wrong.			2022	9	2
2668	Artemis Quote	artemis_quote.png	Another option: "It is an honor to be the first human to set foot on the moon."			2022	9	5
2669	Things You Should Not Do	things_you_should_not_do.png	Now I'm tempted to start telling people that I secretly don't actually know how to do any physics calculations, and so all the answers in What If are based on me actually trying to do the thing and then reporting what happened, but phrased as if it's hypothetical.	https://xkcd.com/what-if-2		2022	9	7
2670	Interruption	interruption.png	It's been extra bad ever since my GPS got stuck on Phoebe Judge mode.			2022	9	9
2671	Rotation	rotation.png	It's okay, we can just feed the one-pixel image into an AI upscaler and recover the original image, or at least one that's just as cool.			2022	9	12
2672	What If? 2 Flowchart	what_if_2_flowchart.png	Don't worry, the dogs are all fine. That's actually kind of the problem.	https://xkcd.com/what-if-2		2022	9	13
2673	Cursed mRNA Cocktail	cursed_mrna_cocktail.png	Serve one each to guests whose last cursed cocktail was more than 2 months ago.			2022	9	16
2674	Everyday Carry	everyday_carry.png	Someday I just know I'm going to encounter a problem that requires 500 flashlights and 700 knives with weird holes in them, and on that day I won't be caught unprepared.			2022	9	19
2675	Pilot Priority List	pilot_priority_list.png	CELEBRATE: Serve passengers tiered cakes shaped like the airspace class diagram			2022	9	21
2676	Historical Dates	historical_dates.png	Evidence suggests the 1899 transactions occurred as part of a global event centered around a deity associated with the lotus flower.			2022	9	23
2677	Two Key System	two_key_system.png	Our company can be your one-stop shop for decentralization.			2022	9	26
2678	Wing Lift	wing_lift.png	Once the air from the top passes below the plane of the wing and catches sight of the spooky skulls, it panics, which is the cause of turbulent vortices.			2022	9	28
2679	Quantified Self	quantified_self.png	It's made me way more excited about ferris wheels, subways, car washes, waterslides, and store entrances that have double doors with a divider in the middle.			2022	9	30
2680	Battery Life	battery_life.png	It's okay, I'm at 10%, so I'm good for another month or two.			2022	10	3
2681	Archimedes Principle	archimedes_principle.png	"I've always wanted to run naked through town, but I don't want to get in trouble with the king or be remembered by history as a weirdo. I wonder how I could ... EUREKA!"			2022	10	5
2682	Easy or Hard	easy_or_hard.png	"Friction-driven static electrification is familiar and fundamental in daily life, industry, and technology, but its basics have long been unknown and have continually perplexed scientists from ancient Greece to the high-tech era. [...] To date, no single theory can satisfactorily explain this mysterious but fundamental phenomenon." --Eui-Cheol Shin et. al. (2022)			2022	10	7
2683	Fan Theories	fan_theories.png	The universe fandom is great. Such sweet and enthusiastic people.			2022	10	10
2684	Road Space Comparison	road_space_comparison.png	I wonder how hard it would be to ride an electric scooter in a hamster ball.			2022	10	12
2685	2045	2045.png	"Sorry, doctor, I'm going to have to come in on a different day--I have another appointment that would be really hard to move, in terms of the kinetic energy requirements."			2022	10	14
2686	Space Adventure	space_adventure.png	"Sir, it looked really cool." "Oh no--prestige TV. Okay, which of you has a terrible secret that's being slowly revealed to the audience through flashbacks? Just spit it out so we can escape this arc!"			2022	10	17
2687	Division Notation	division_notation.png	Science tip: Scientists hardly ever use the two-dot division sign, and when they do it often doesn't even mean division, but they still get REALLY mad when you repurpose it to write stuff like SALE! ALL SHOES 30÷ OFF!			2022	10	19
2688	Bubble Universes	bubble_universes.png	The theory finally unifies cosmic inflation and regular inflation.			2022	10	21
2689	Fermat's First Theorem	fermats_first_theorem.png	Mathematicians quickly determined that it spells ANT BNECN, an unusual theoretical dish which was not successfully cooked until Andrew Wiles made it for breakfast in the 1990s.			2022	10	24
2690	Cool S	cool_s.png	Although I hear they were caught cheating off of Rosalind, who sat at a desk in front of them.			2022	10	26
2691	Encryption	encryption.png	WARNING: PEOPLE NAMED EVE ARE PROHIBITED FROM INSTALLING THIS APP!			2022	10	28
2692	Interior Decorating	interior_decorating.png	It all came flat-packed in Pandora's Box.			2022	10	31
2693	Wirecutter Recommendation	wirecutter_recommendation.png	Their 'best philosophy of epistemology' picks are great, but you can tell they're struggling a little in the 'why you should trust us' section.			2022	11	2
2694	Königsberg	konigsberg.png	At first I thought I would need some gold or something to pay him, but then I realized that it was the 18th century and I could just bring a roll of aluminum foil.			2022	11	4
2695	Soil	soil.png	You might want to bring your frost-sensitive plants in from the patio. The high-level aerosols may result in short-term cooling across the entire backyard.			2022	11	7
2696	Precision vs Accuracy	precision_vs_accuracy.png	'Barack Obama is much less likely than the average cat to jump in and out of cardboard boxes for fun' is low precision, but I'm not sure about the accuracy.			2022	11	9
2697	Y2K and 2038	y2k_and_2038.png	It's taken me 20 years, but I've finally finished rebuilding all my software to use 33-bit signed ints.			2022	11	11
2698	Bad Date	bad_date.png	"Even split between us, this will pay way better than the Jumanji sponsorship I came into the date with."			2022	11	14
2699	Feature Comparison	feature_comparison.png	Below the Web, and the Dark Web, a shadowy parallel world of Cybiko users trade messages on the Translucent Neon Plastic Web.			2022	11	16
2700	Account Problems	account_problems.png	My password is just every Unicode codepoint concatenated into a single UTF-8 string.			2022	11	18
2701	Change in Slope	change_in_slope.png	Squinting at a graph is fine for getting a rough idea of the answer, but if you want to pretend to know it exactly, you need statistics.			2022	11	21
2702	What If 2 Gift Guide	what_if_2_gift_guide.png	BABIES OR LITERATURE BUT NOT BOTH: Baby shoes	https://xkcd.com/what-if-2		2022	11	23
2703	Paper Title	paper_title.png	CONFLICT OF INTEREST STATEMENT: The authors hope these results are correct because we all want to be cool people who are good at science.			2022	11	25
2704	Faucet	faucet.png	It's okay, they can figure out which control positions produce scalding water via a trial-and-error feedback loop with a barely-perceptible 10-second lag.			2022	11	28
2705	Spacetime Soccer	spacetime_soccer.png	Spacetime Soccer, known outside the United States as '4D Football' is a now-defunct sport. Infamous for referee decisions hinging on inconsistent definitions of simultaneity, it is also known for the disappearance of many top players during... [more]			2022	11	30
2706	Bendy	bendy.png	Squaring the circle is really easy with some good clamps.			2022	12	2
2707	Astronomy Numbers	astronomy_numbers.png	I adopted a cat that weighs 12 solar masses. Laser pointers love chasing it.			2022	12	5
2708	Mystery Asterisk Destination	mystery_asterisk_destination.png	If you ever see the † dagger symbol with no unmatched footnote, it means the writer is saying the phrase while threatening you with a dagger.			2022	12	7
2709	Solar System Model	solar_system_model.png	The Earth is, on average, located in the habitable zone, but at any given time it has a certain probability of being outside it, which is why life exists on Earth but is mortal.			2022	12	9
2710	Hydropower Breakthrough	hydropower_breakthrough.png	A hydroelectric dam is also known as a heavy water reactor.			2022	12	12
2711	Optimal Bowling	optimal_bowling.png	If you want to bowl a strike, the optimal place is almost certainly inside a bowling alley, although with a little luck any establishment uphill from one could also work.			2022	12	14
2712	Gravity	gravity.png	It's a long way down.			2022	12	16
2713	Data Point	data_point.png	In general you should only include your single best data point in the paper. The rest of the data can go in the supplementary materials.			2022	12	19
2714	Cold Complaints	cold_complaints.png	Our investigation into whining-based remedies became the first study to be halted by the IRB on the grounds that the treatment group was 'too annoying.'			2022	12	21
2715	Pando	pando.png	The presents under the tree are actually a single gift connected by an underground ribbon system.			2022	12	23
2716	Game Night Ordering	game_night_ordering.png	One good trick, if you get called on a fake service, is to build a working version of it and mention it again the next week.			2022	12	26
2717	L6 Lagrange Point	l6_lagrange_point.png	It's difficult to orbit L6 stably due to gravitational perturbation from Akron and Toledo.			2022	12	28
2718	New Year's Eve Party	new_years_eve_party.png	[Earlier, at the eye doctor] 'No, for the last time, the numerals on the paper aren't my prescription, it's the shape I want you to make with the laser.'			2022	12	30
2719	Hydrogen Isotopes	hydrogen_isotopes.png	Oops, All Neutrons is also known as Neutral Quadrium, Nydnonen, and Goth Tritium.			2023	1	2
2720	Biology vs Robotics	biology_vs_robotics.png	Sorry, I've just always had these random things I don't like--like olives, or robots drilling holes in me without warning.			2023	1	4
2721	Euler Diagrams	euler_diagrams.png	Things Leonhard Euler created ( most of math ( overlapping circle diagrams ) a cricket bowling machine ) Things John Venn created			2023	1	6
2722	Etymonline	etymonline.png	NOTE TO FUTURE ETYMONLINGUISTS: Our best guess is that 'blimp' is onomatopoeia. The 'B-Limp' thing is a folk etymology.			2023	1	9
2723	Outdated Periodic Table	outdated_periodic_table.png	Researchers claim to have synthesized six additional elements in the second row, temporarily named 'pentium' through 'unnilium'.			2023	1	11
2724	Washing Machine Settings	washing_machine_settings.png	I guess the engineers who built my dishwasher MIGHT have some insight into how to load it, but instead of reading the booklet they gave me, it seems easier to experiment for years and then get in arguments so heated that I get banned from Quora.			2023	1	13
2725	Sunspot Cycle	sunspot_cycle.png	Who can forget the early 2010s memes? 'You know you're a 90s kid if you remember the feeling of warm sunlight on your face.' 'Only 90s kids remember the dawn.'			2023	1	16
2726	Methodology Trial	methodology_trial.png	If you think THAT'S unethical, you should see the stuff we approved via our Placebo IRB.			2023	1	18
2727	Runtime	runtime.png	At least there's a general understanding all around that Doctor Who is its own thing.			2023	1	20
2728	Lane Change Highway	lane_change_highway.png	I just think lane markers should follow the local magnetic declination.			2023	1	23
2729	Planet Killer Comet Margarita	planet_killer_comet_margarita.png	I'll take mine on the rocks, no ice.		Today's comic was drawn for Daniel Becker, based on<br /><a href="https://what-if.xkcd.com/162/">his winning question</a> submitted to the <a href="https://xkcd.com/what-if-2/">What If? 2</a> contest.	2023	1	25
2730	Code Lifespan	code_lifespan.png	Surely (no one/everyone) will (recognize how flexible and useful this architecture is/spend a huge amount of effort painstakingly preserving and updating this garbage I wrote in 20 minutes)			2023	1	27
2731	K-Means Clustering	k_means_clustering.png	According to my especially unsupervised K-means clustering algorithm, there are currently about 8 billion types of people in the world.			2023	1	30
2732	Bursa of Fabricius	bursa_of_fabricius.png	If an anatomical structure is named for a person, it means they were the only person to have it. Pierre Paul Broca had a special area of his brain that created powerful magnetic fields, enabling him to do 19th century fMRI research.			2023	2	1
2733	Size Comparisons	size_comparisons.png	If you shrank the Solar System to the size of Texas, the Houston metro area would be smaller than a grasshopper in Dallas.			2023	2	3
2734	Electron Color	electron_color.png	There's quark color, but that's not really color--it's just an admission by 20th century physicists that numbers are boring.			2023	2	6
2735	Coordinate Plane Closure	coordinate_plane_closure.png	3D graphs that don't contact the plane in the closure area may proceed as scheduled, but be alert for possible collisions with 2D graph lines that reach the hole and unexpectedly enter 3D space.			2023	2	8
2736	Only Serifs	only_serifs.png	If you ever want to get beaten up by a bunch of graphic designers, try removing the serifs from Times New Roman and adding them to Comic Sans.			2023	2	10
2737	Weather Station	weather_station.png	'Pour one out for precipitation data integrity,' I say, solemnly upending the glass into the rain gauge.			2023	2	13
2738	Omniknot	omniknot.png	The Gordian knot is an omniknot tied using every bend in the Ashley Book of Knots, and then for extra security the upper rope at every crossing is connected to the lower with a randomly-chosen hitch.			2023	2	15
2739	Data Quality	data_quality.png	[exclamation about how cute your cat is] -> [last 4 digits of your cat's chip ID] -> [your cat's full chip ID] -> [a drawing of your cat] -> [photo of your cat] -> [clone of your cat] -> [your actual cat] -> [my better cat]			2023	2	17
2740	Square Packing	square_packing.png	I also managed to improve the solution for n=1 to s<0.97, and with some upgrades I think I can hit 0.96.			2023	2	20
2741	Wish Interpretation	wish_interpretation.png	"I wish for everything in the world. All the people, money, trees, etc." "Are you SURE you--" "And I want you to put it in my house."			2023	2	22
2742	Island Storage	island_storage.png	I always hate dragging around the larger archipelagos, but I appreciate how the Scandinavian peninsula flexes outward to create a snug pocket for Britain and Ireland.			2023	2	24
2743	Hand Dryers	hand_dryers.png	I know hand dryers have their problems, but I think for fun we should keep egging Dyson on and see if we can get them to make one where the airflow breaks the speed of sound.			2023	2	27
2744	Fanservice	fanservice.png	I was eventually kicked out of my architectural engineering program because I wouldn't stop referring to HVAC as "the fandom."			2023	3	1
2745	Obituary Editor	obituary_editor.png	As the editor has reportedly defeated Death in a series of games of skill, no further obituaries are expected.			2023	3	3
2746	Launch Window	launch_window.png	"Confirmed, we have to scrub." "Ugh, okay. I'll get the bucket and sponge."			2023	3	6
2747	Presents for Biologists	presents_for_biologists.png	A lot of these are actually non-venomous, but I can see which species you mistook them for. If you pause the crane for a sec I can give you some ID pointers for next time!			2023	3	8
2748	Radians are Cursed	radians_are_cursed.png	Phil Plait once pointed out that you can calculate the total angular area of the sky this way. If the sky is a sphere with radius 57.3 degrees, then its area is 4*pi*r^2=41,253 square degrees. This makes dimensional analysts SO mad, but you can't argue with results.			2023	3	10
2749	Lymphocytes	lymphocytes.png	It's very hard to detect, but recent studies have determined that when plasma B cells are producing antibodies, they go 'pew pew pew'			2023	3	13
2750	Flatten the Planets	flatten_the_planets.png	We'll turn the asteroid belt into ball bearings to go between different rings orbiting at different speeds.			2023	3	15
2751	March Madness	march_madness.png	My bracket has 76 trombones led by John Philip Sousa facing off against thousands of emperor penguins led by Morgan Freeman.			2023	3	17
2752	Salt Dome	salt_dome.png	The US uses hollowed-out salt domes to store the Strategic Petroleum Reserve, and non-hollowed-out ones to store the Strategic Salt Reserve.			2023	3	20
2753	Air Handler	air_handler.png	It maintains odor levels in a normal familiar range, so if you open the windows and the air gets too fresh, it filters it through some dirty laundry samples to compensate.			2023	3	22
2754	Relative Terms	relative_terms.png	Small sewing machines are sewing machines that are smaller than a sewing machine. A sewing machine is larger than a small sewing machine, but quieter than a loud sewing machine.			2023	3	24
2755	Effect Size	effect_size.png	Subgroup analysis is ongoing.			2023	3	27
2756	Qualifications	qualifications.png	'So how DID you go from working at the employment records office to becoming president of MIT and CEO of IBM?' 'I guess I just have an eye for opportunities.'			2023	3	29
2757	Towed Message	towed_message.png	"Hi, what you do is fly over a designated zone and detach the--" "WE'RE SORRY, THE MOBILE CUSTOMER YOU ARE TRYING TO REACH IS OUT OF SERVICE"			2023	3	31
2758	My Favorite Things	my_favorite_things.png	When an Ur guy / sells Nanni things / but the copper's bad, / He simply records his complaint for all time / "I got a bad deal / I'm maaaaad"			2023	4	3
2759	Easily Confused Acronyms	easily_confused_acronyms.png	'Lever' was originally an acronym for Load Emplification by the Vimulated Emission of Radiation.			2023	4	5
2760	Paleontology Museum	paleontology_museum.png	Nowadays the only ones left that do anything are turtles.			2023	4	7
2761	1-to-1 Scale	1_to_1_scale.png	There's a version that shows the planets with no cropping, but it's hard to find a display that supports it.			2023	4	10
2762	Diffraction Spikes	diffraction_spikes.png	Even if a planet is lucky enough to have a stable orbit that weaves between the spikes, the seasons get weird whenever it passes close to them.			2023	4	12
2763	Linguistics Gossip	linguistics_gossip.png	The E's wedding invitation definitely used the word LOVE more times than was strictly necessary.			2023	4	14
2764	Cosmological Nostalgia Content	cosmological_nostalgia_content.png	Later renouncing clickbait, Einstein called his inclusion of cosmological content in general relativity the biggest blunder of his career.			2023	4	17
2765	Escape Speed	escape_speed.png	Gotta go fast		Today's comic was put together with help from <a href="https://chromakode.com/">Max Goodhart</a>, <a href="https://www.instagram.com/fading_interest/">Patrick Clapp</a>, <a href="https://amberyu.st/">Amber</a>, <a href="https://twitter.com/cotrone">Kevin</a>, <a href="https://twitter.com/bstaffin">Benjamin Staffin</a>, and <a href="https://www.aiweirdness.com/">Janelle Shane</a>.	2023	4	19
2766	Helium Reserve	helium_reserve.png	The government has been trying to sell off the Federal Helium Reserve for a few years now, but the sale has been on hold while they try to figure out how to explain this situation to buyers.			2023	4	21
2767	Recipe Relativity	recipe_relativity.png	It says to cut the onions into 1/4" slices, but I'd better correct for length contraction.			2023	4	24
2768	Definition of e	definition_of_e.png	Yeah, my math teacher back in high school set up the system to try to teach us something or other, but the 100% rate was unbelievably good, so I engineered a hostile takeover of his bank and now use it to make extra cash on the side.			2023	4	26
2769	Overlapping Circles	overlapping_circles.png	"The Venn diagram of the sun and the moon is a circle." --someone being snarky at totality			2023	4	28
2770	Tapetum Lucidum	tapetum_lucidum.png	Using a reflective wall in a game to give one shot two chances to hit is called a double-tapetum lucidum.			2023	5	1
2771	College Knowledge	college_knowledge.png	'Your chitin armor is no match for our iron-tipped stingers! Better go hide in your jars!' --common playground taunt			2023	5	3
2772	Commemorative Plaque	commemorative_plaque.png	[Below] On this site on May 12th, 2023, I finally learned how to use the masonry bit for my drill.			2023	5	5
2773	Planetary Scientist	planetary_scientist.png	This rumpled fabric at the corner looks like evidence of ongoing tectonic activity.			2023	5	8
2774	Taxiing	taxiing.png	I don't understand why anyone would pay full price for a flatbed truck rental when you can buy 'DETOUR' signs online for like $10.			2023	5	10
2775	Siphon	siphon.png	ADDITIONAL NOTES: Fixed a bug that caused some rocks to generate virtually infinite heat while just sitting there.			2023	5	12
2776	Crystal Ball	crystal_ball.png	They often use ball lenses to collect light at the ends of optical fibers, so when you look stuff up on the internet you're actually scrying through a crystal ball.			2023	5	15
2777	Noise Filter	noise_filter.png	Party Mode also enables the feature, but reverses the slider.			2023	5	17
2778	Cuisine	cuisine.png	My connection to it goes way back, to my early days, when I was just a cloud of primordial hydrogen collapsing in the darkness of space.			2023	5	19
2779	Exoplanet High-5	exoplanet_high_5.png	Tau Ceti is farther away, so it took me 36 years to start the war over updog.			2023	5	22
2780	Physical Quantities	physical_quantities.png	The Hubble length is about 1.9 meters lying down; Edwin Hubble was a tall guy.			2023	5	24
