num	safe_title	img	alt	link	news	year	month	day
1651	Robotic Garage	robotic_garage.png	But listen, if getting your car out from under the pile is REALLY important to you, we do have an axe you can borrow.			2016	3	4
1652	Conditionals	conditionals.png	'If you're done being pedantic, we should get dinner.' 'You did it again!' 'No, I didn't.'			2016	3	7
1653	United States Map	united_states_map.png	It would be pretty unfair to give to someone a blank version of this map as a 'how many states can you name?' quiz. (If you include Alaska and Hawaii, you should swap the Aleutian Islands with the Hawaiian ones.)			2016	3	9
1654	Universal Install Script	universal_install_script.png	The failures usually don't hurt anything, and if it installs several versions, it increases the chance that one of them is right. (Note: The 'yes' command and '2>/dev/null' are recommended additions.)			2016	3	11
1655	Doomsday Clock	doomsday_clock.png	After a power outage at the Bulletin of the Atomic Scientists, the new Digital Doomsday Clock is flashing 00:00 and mushroom clouds keep appearing and then retracting once a second.			2016	3	14
1656	It Begins	it_begins.png	You can also try 'Yikes.'			2016	3	16
1657	Insanity	insanity.png	I looked up "insanity" in like 10 different dictionaries and none of them said anything like that. Neither did the DSM-4. But I'll keep looking. Maybe it's in the DSM-5!			2016	3	18
1658	Estimating Time	estimating_time.png	Corollary to Hofstadter's Law: Every minute you spend thinking about Hofstadter's Law is a minute you're NOT WORKING AND WILL NEVER FINISH! PAAAAAANIIIIIIC!			2016	3	21
1659	Tire Swing	tire_swing.png	If we find one of those tire dumps, the next time he tries to get his truck back we can just retreat and let him have it.			2016	3	23
1660	Captain Speaking	captain_speaking.png	Oh dang, you have to pay? Hey, has anyone else paid already? If so, can I borrow your phone for a sec?			2016	3	25
1661	Podium	podium.png	BREAKING: Senator's bold pro-podium stand leads to primary challenge from prescriptivist base.			2016	3	28
1662	Jack and Jill	jack_and_jill.png	Jill and Jack / began to frack. / The oil boosts their town. / But fractures make / the bedrock shake / and Jack came tumbling down.			2016	3	30
1663	Garden		Relax.		<b>Protip:</b> If you don't like how your garden is growing, you can click to prune it.<br />Copy the URL to save/share (garden will be view-only from other browsers.)	2016	4	4
1664	Mycology	mycology.png	Conspiracy theory: There's no such thing as corn. Those fields you see are just the stalks of a fungus that's controlling our brains to make us want to spread it.			2016	4	6
1665	City Talk Pages	city_talk_pages.png	I don't think the Lakeshore Air Crash Museum really belongs under 'Tourist Attractions.' It's not a museum--it's just an area near the Lake Festival Laser Show where a lot of planes have crashed.			2016	4	8
1666	Brain Upload	brain_upload.png	I just spent 20 minutes deciding whether to start an email with 'Hi' or 'Hey', so I think it transferred correctly.			2016	4	11
1667	Algorithms	algorithms.png	There was a schism in 2007, when a sect advocating OpenOffice created a fork of Sunday.xlsx and maintained it independently for several months. The efforts to reconcile the conflicting schedules led to the reinvention, within the cells of the spreadsheet, of modern version control.			2016	4	13
1668	Singularity	singularity.png	I figured that now that society has collapsed, I wouldn't need to wear clothes anymore, but apparently that violates some weird rule of quantum gravity.			2016	4	15
1669	Planespotting	planespotting.png	No, a hydroplane doesn't land on water--that's an aquaplane. A hydroplane is a plane that gets electric power from an onboard water reservoir with a tiny dam and turbines.			2016	4	18
1670	Laws of Physics	laws_of_physics.png	The laws of physics are fun to try to understand, but as an organism with incredibly delicate eyes who evolved in a world full of sharp objects, I have an awful lot of trust in biology's calibration of my flinch reflex.			2016	4	20
1671	Arcane Bullshit	arcane_bullshit.png	Learning arcane bullshit from the 80s can break your computer, but if you're willing to wade through arcane bullshit from programmers in the 90s and 2000s, you can break everyone else's computers, too.			2016	4	22
1672	Women on 20s	women_on_20s.png	I get that there are security reasons for the schedule, but this is like the ONE problem we have where the right answer is both easy and straightforward. If we can't figure it out, maybe we should just give up and just replace all the portraits on the bills with that weird pyramid eye thing.			2016	4	25
1673	Timeline of Bicycle Design	timeline_of_bicycle_design.png	I'll be honest--the 1950s were a rough time for cycling.			2016	4	27
1674	Adult	adult.png	(1) That shopping cart is full of AirHeads, and (2) I died at 41 from what the AirHeads company spokesperson called 'probably natural causes.'			2016	4	29
1675	Message in a Bottle	message_in_a_bottle.png	I tried to send a message back, but I accidentally hit 'reply all' and now the ocean is clogged with message bottles.			2016	5	2
1676	Full-Width Justification	full_width_justification.png	Gonna start bugging the Unicode consortium to add snake segment characters that can be combined into an arbitrary-length non-breaking snake.			2016	5	4
1677	Contrails	contrails.png	Astronomy (or "astrology" in British English) is the study of ...			2016	5	6
1678	Recent Searches	recent_searches.png	autoexec code posted by verified twitter users			2016	5	9
1679	Substitutions 3	substitutions_3.png	BREAKING: Channing Tatum and his friends explore haunted city		(Previously: <a href="https://xkcd.com/1288/">Substitutions</a> and <a href="https://xkcd.com/1625/">Substitutions 2</a>)<br />Note: There are various <a href="https://chrome.google.com/webstore/detail/replacerator/gaajhenbcclienfnniphiiambbbninnp?hl=en">browser extensions</a> for this.	2016	5	11
1680	Black Hole	black_hole.png	It also brings all the boys, and everything else, to the yard.			2016	5	13
1681	Laser Products	laser_products.png	ERRORS: HAIR JAM. COLOR-SAFE CONDITIONER CARTRIDGE RUNNING LOW. LEGAL-SIZE HAIR TRAY EMPTY, USING LETTER-SIZE HAIR ONLY.			2016	5	16
1682	Bun	bun.png	If a wild bun is sighted, a nice gesture of respect is to send a 'BUN ALERT' message to friends and family, with photographs documenting the bun's location and rank. If no photographs are possible, emoji may be substituted.			2016	5	18
1683	Digital Data	digital_data.png	â€œIf you can read this, congratulationsâ€”the archive youâ€™re using still knows about the mouseover textâ€!			2016	5	20
1684	Rainbow	rainbow.png	Listen, in a few thousand years you'll invent a game called 'SimCity' which has a 'disaster' button, and then you'll understand.			2016	5	23
1685	Patch	patch.png	My optimizer uses content-aware inpainting to fill in all the wasted whitespace in the code, repeating the process until it compiles.			2016	5	25
1686	Feel Old	feel_old.png	'How long are you going to keep this up?' 'Statistically, only four or five more decades.'			2016	5	27
1687	World War III+	world_war_iii.png	I hate how the media only ever uses the first part of this quote, stripping it of its important context.			2016	5	30
1688	Map Age Guide	map_age_guide.png	Does the screeching chill your blood and herald death? If yes, banshee. If no, seagull.	https://xkcd.com/1688/large/		2016	6	1
1689	My Friend Catherine	my_friend_catherine.png	I can't get any work done because my friend Catherine is sitting on my keyboard.			2016	6	3
1690	Time-Tracking Software	time_tracking_software.png	'List of helicopter prison escapes' and 'List of sexually active popes' are both entertainingly long, but sadly there's no 'List of helicopter prison escapes involving sexually active popes.'			2016	6	6
1691	Optimization	optimization.png	Premature optimization is the root of all evil, so to start this project I'd better come up with a system that can determine whether a possible optimization is premature or not.			2016	6	8
1692	Man Page	man_page.png	For even more info, see blarbl(2)(3) and birb(3ahhaha I'm kidding, just Google it like a normal person.			2016	6	10
1693	Oxidation	oxidation.png	Calm down--there were lots of arthropods living on your skin already. These ones are just bigger.			2016	6	13
1694	Phishing License	phishing_license.png	Later, walking out of jail after posting $10,000 bail: "Wait, this isn't the street the county jail is on."			2016	6	15
1695	Code Quality 2	code_quality_2.png	It's like you tried to define a formal grammar based on fragments of a raw database dump from the QuickBooks file of a company that's about to collapse in an accounting scandal.			2016	6	17
1696	AI Research	ai_research.png	Lambda calculus? More like SHAMbda calculus, amirite?			2016	6	20
1697	Intervocalic Fortition	intervocalic_fortition.png	These pranks happen all the time. English doesn't allow one-syllable words to end in a lax vowel, so writers on The Simpsons decided to mess with future linguists by introducing the word "meh."			2016	6	22
1698	Theft Quadrants	theft_quadrants.png	TinyURL was the most popular link shortener for long enough that it made it into a lot of printed publications. I wonder what year the domain will finally lapse and get picked up by a porn site.			2016	6	24
1699	Local News	local_news.png	Will there ever be a physics term greater than 'tachyonic antitelephone?' According to this message from the future, the answer is 'no.'			2016	6	27
1700	New Bug	new_bug.png	There's also a unicode-handling bug in the URL request library, and we're storing the passwords unsalted ... so if we salt them with emoji, we can close three issues at once!			2016	6	29
1701	Speed and Danger	speed_and_danger.png	NASCAR removed the passenger seats because drivers hated how astronauts kept riding along with them and loudly announcing "Ahh, what a nice and relaxing drive."			2016	7	1
1702	Home Itch Remedies	home_itch_remedies.png	In my experience, mosquitos and poison ivy are bad, but the very worst itch comes from bites from chiggers (Trombicula alfreddugesi). They're found across the American south and great plains, so the best home remedy is to move to Iceland.			2016	7	4
1703	Juno	juno.png	"The name wasn't a tip-off?" "Honestly, at first I thought you were saying 'Juneau'. A gravity assist seemed like a weird way to get to Alaska, but I figured it must be more efficient or something."			2016	7	6
1704	Gnome Ann	gnome_ann.png	President Andrew Johnson once said, "If I am to be shot at, I want Gnome Ann to be in the way of the bullet."			2016	7	8
1705	Pokémon Go	pokemon_go.png	Still waiting for the Pokémon Go update that lets you capture strangers' pets.			2016	7	11
1706	Genetic Testing	genetic_testing.png	Plus, now I know that I have risk factors for elbow dysplasia, heartworm, parvo, and mange.			2016	7	13
1707	xkcd Phone 4	xkcd_phone_4.png	The SpaceX system carefully guides falling phones down to the surface, a process which the phones increasingly often survive without exploding.			2016	7	15
1708	Dehydration	dehydration.png	I don't care what the research says. Everybody knows you should drink 3,000 glasses of water a day and change your oil every 8 miles.			2016	7	18
1709	Inflection	inflection.png	"Or maybe, because we're suddenly having so many conversations through written text, we'll start relying MORE on altered spelling to indicate meaning!" "Wat."			2016	7	20
1710	Walking Into Things	walking_into_things.png	A childhood spent walking while reading books has prepared me unexpectedly well for today's world.			2016	7	22
1711	Snapchat	snapchat.png	For obvious reasons, the prize is awarded at a different time of year from the others, while it's still fresh in the committee's memory.			2016	7	25
1712	Politifact	politifact.png	"Ok, I lit the smoke bomb and rolled it under the bed. Let's see if it--" ::FWOOOSH:: "Politifact says: PANTS ON FIRE!"			2016	7	27
1713	50 ccs	50_ccs.png	There's been a raccoon accident at an accordion bacchanalia! Double doses!			2016	7	29
1714	Volcano Types	volcano_types.png	It's hard living somewhere with antlions, because every time you find one of their traps, you feel compelled to spend all day constructing a tiny model of Jabba's sail barge next to it.			2016	8	1
1715	Household Tips	household_tips.png	To make your shoes feel more comfortable, smell better, and last longer, try taking them off before you shower.			2016	8	3
1716	Time Travel Thesis	time_travel_thesis.png	'Hey, what are those futuristic goggles for, anyway?' 'Oh, this is just a broken Google Glass. It was 2010's night at the club.'			2016	8	5
1717	Pyramid Honey	pyramid_honey.png	They CLAIM honey was found in the chambers under the pyramids, but this conspiracy goes all the way to the TOP, where the GIANT EYE is!			2016	8	8
1718	Backups	backups.png	Maybe you should keep FEWER backups; it sounds like throwing away everything you've done and starting from scratch might not be the worst idea.			2016	8	10
1719	Superzoom	superzoom.png	*click* Let him know he's got a stain on his shirt, though.			2016	8	12
1720	Horses	horses.png	This car has 240% of a horse's decision-making ability and produces only 30% as much poop.			2016	8	15
1721	Business Idea	business_idea.png	Then we move to phase two. Gas stations store fuel in underground tanks. Normally, these are inaccessible except via the pump. However, with hydraulic fracturing, we-- Wait! Come back!			2016	8	17
1722	Debugging	debugging.png	When you Google an error message and it gets no results, you can be pretty sure you've found a clue to the location of Martin's sword.			2016	8	19
1723	Meteorite Identification	meteorite_identification.png	Click for an actual flowchart for identifying a meteorite. My favorite part is how 'Did someone see it fall? -> Yes' points to 'NOT A METEORITE.' This is not a mistake.	https://sites.wustl.edu/meteoritesite/items/self-test-check-list/	Note: Jolyon, founder of <a href="https://mindat.org">mindat.org</a>, made a similar chart way before me!	2016	8	22
1724	Proofs	proofs.png	Next, let's assume the decision of whether to take the Axiom of Choice is made by a deterministic process ...			2016	8	24
1725	Linear Regression	linear_regression.png	The 95% confidence interval suggests Rexthor's dog could also be a cat, or possibly a teapot.			2016	8	26
1726	Unicode	unicode.png	I'm excited about the proposal to add a "brontosaurus" emoji codepoint because it has the potential to bring together a half-dozen different groups of pedantic people into a single glorious internet argument.			2016	8	29
1727	Number of Computers	number_of_computers.png	They try to pad their numbers in the annual reports by counting Galileo's redundant systems as multiple computers, but they're falling behind badly either way.			2016	8	31
1728	Cron Mail	cron_mail.png	Take THAT, piece of 1980s-era infrastructure I've inexplicably maintained on my systems for 15 years despite never really learning how it works.			2016	9	2
1729	Migrating Geese	migrating_geese.png	"Hey guys! I have a great idea for a migration!" "Dammit, Kevin."			2016	9	5
1730	Starshade	starshade.png	The New Worlds Mission is already trying to get funding for this, but NASA sponsored their proposal, so it will be hard to catch the telescope people by surprise with it.			2016	9	7
1731	Wrong	wrong.png	Hang on, I just remembered another thing I'm right about. See...			2016	9	9
1732	Earth Temperature Timeline	earth_temperature_timeline.png	[After setting your car on fire] Listen, your car's temperature has changed before.			2016	9	12
1733	Solar Spectrum	solar_spectrum.png	I still don't understand why the Sun paid the extra money for Transitions lenses.			2016	9	15
1734	Reductionism	reductionism.png	"I've noticed you physics people can be a little on the reductionist side." "That's ridiculous. Name ONE reductionist word I've ever said."			2016	9	16
1735	Fashion Police and Grammar Police	fashion_police_and_grammar_police.png	* Mad about jorts			2016	9	19
1736	Manhattan Project	manhattan_project.png	On the plus side, we definitely killed that cancer over there, even if we caused a bunch more everywhere else.			2016	9	21
1737	Datacenter Scale	datacenter_scale.png	Asimov's Cosmic AC was created by linking all datacenters through hyperspace, which explains a lot. It didn't reverse entropy--it just discarded the universe when it reached end-of-life and ordered a new one.			2016	9	23
1738	Moon Shapes	moon_shapes.png	Whenever I see a picture of the moon where the points go more than halfway around, I assume it's being eclipsed by one of those Independence Day ships and interpret the rest of the image in light of that.		<br />Thank you to Phil Plait for the correction on #4!	2016	9	26
1739	Fixing Problems	fixing_problems.png	'What was the original problem you were trying to fix?' 'Well, I noticed one of the tools I was using had an inefficiency that was wasting my time.'			2016	9	28
1740	Rosetta	rosetta.png	I WONDERED why he kept asking whether we thought the impact speed was too low.			2016	9	30
1741	Work	work.png	Despite it being imaginary, I already have SUCH a strong opinion on the cord-switch firing incident.			2016	10	3
1742	Will It Work	will_it_work.png	'Copy and paste from a random thread on a website' is the hardest to predict, and depends on the specific website, programming language, tone of the description, and current phase of the moon.			2016	10	5
1743	Coffee	coffee.png	Remind me to order another pack of coffee filters from Dyson. Man, these things are EXPENSIVE.			2016	10	7
1744	Metabolism	metabolism.png	I have this weird thing where if I don't drink enough water, I start feeling bad and then die of dehydration.			2016	10	10
1745	Record Scratch	record_scratch.png	The 78-rpm era was closer to the Civil War than to today.			2016	10	12
1746	Making Friends	making_friends.png	"This seems more like a way to attract turkey vultures." "My mom always told me a turkey vulture is just a friend you haven't met yet, usually because you don't smell enough like decaying meat."			2016	10	14
1747	Spider Paleontology	spider_paleontology.png	Whenever you see a video of birds doing something weird, remember: Birds are a small subset of dinosaurs, so the weirdness of birds is a small subset of the weirdness of dinosaurs.			2016	10	17
1748	Future Archaeology	future_archaeology.png	"The only link we've found between the two documents is that a fragment of the Noah one mentions Aaron's brother Moses parting an ocean. Is that right?" "... yes. Yes, exactly."			2016	10	19
1749	Mushrooms	mushrooms.png	Evolutionarily speaking, mushrooms are technically a type of ghost.			2016	10	21
1750	Life Goals	life_goals.png	I got to check off 'Make something called xkcd' early.			2016	10	24
1751	Movie Folder	movie_folder.png	That's actually the original Japanese version of A Million Random Digits, which is much better than the American remake the book was based on.			2016	10	26
1752	Interplanetary Experience	interplanetary_experience.png	But instead of hitting the ocean, you should land in an overheating hot tub on a sinking cruise ship, sending it crashing through the floor into the burning engine room as the ship goes under.			2016	10	28
1753	Thumb War	thumb_war.png	"Seventeen, eighteen, nineteen, twenty--" / "Can't we just read Pat the Bunny?"			2016	10	31
1754	Tornado Safety Tips	tornado_safety_tips.png	It's a myth that you can never cross mountains safely, but be sure you understand how the climatic situation there will affect your parent thunderstorm.			2016	11	2
1755	Old Days	old_days.png	Lot of drama in those days, including constant efforts to force the "Reflections on Trusting Trust" guy into retirement so we could stop being so paranoid about compilers.			2016	11	4
1756	I'm With Her	im_with_her.png	We can do this.			2016	11	7
1757	November 2016	november_2016.png	Once you've done this, make a note of how old they were. Then, when their age reaches double that, show them this chart again.			2016	11	9
1758	Astrophysics	astrophysics.png	DEPARTMENT OF NEUROSCIENCE / Motto: "If I hear the phrase 'mirror neurons' I swear to God I will flip this table."			2016	11	11
1759	British Map	british_map.png	West Norsussex is east of East Norwessex, but they're both far north of Middlesex and West Norwex.			2016	11	14
1760	TV Problems	tv_problems.png	Certified skydiving instructors know way more about safely falling from planes than I do, and are way more likely to die that way.			2016	11	16
1761	Blame	blame.png	I bet if I yell at my scared friends I will feel better.			2016	11	18
1762	Moving Boxes	moving_boxes.png	Later, when I remember that I'm calling movers, I frantically scribble over the labels and write 'NORMAL HOUSE STUFF' on all of them, which actually makes things worse.			2016	11	21
1763	Catcalling	catcalling.png	Effect strength => [unstoppable] | Effect range => [2 miles] | Effect duration => [1 year]			2016	11	23
1764	XKCDE	xkcde.png	4. They unplug the root machine but the thousands of leaf VMs scatter in the wind and start spinning up new instances wherever they land			2016	11	25
1765	Baby Post	baby_post.png	[bzzzt] "REMEMBER TO CHECK IN FOR YOUR FLIGHT TO LONDON." "My wha-" [bzzzt] "YOUR UBER WILL ARRIVE IN FOUR MINUTES."			2016	11	28
1766	Apple Spectrum	apple_spectrum.png	If I were trapped on a desert island, and could have an unlimited supply of any one type of apple, I'd be like, "How did this situation happen?"			2016	11	30
1767	US State Names	us_state_names.png	Technically DC isn't a state, but no one is too pedantic about it because they don't want to disturb the snakes.			2016	12	2
1768	Settling	settling.png	Of course, "Number of times I've gotten to make a decision twice to know for sure how it would have turned out" is still at 0.			2016	12	5
1769	Never Seen Star Wars	never_seen_star_wars.png	If anyone calls you on any weird detail, just say it's from the Jedi Prince book series, which contains so much random incongruous stuff that even most Expanded Universe/Legends fans collectively agreed to forget about it decades ago.			2016	12	7
1770	UI Change	ui_change.png	I know they said this change is permanent, but surely when they hear how much we're complaining someone will find a way to change things back.			2016	12	9
1771	It Was I	it_was_i.png	It me, your father.			2016	12	12
1772	Startup Opportunity	startup_opportunity.png	While there's no formal regulation, it turns out their industry group is NOT one you want mad at you.			2016	12	14
1773	Negativity	negativity.png	[Google search] how do I block my lawn			2016	12	16
1774	Adjective Foods	adjective_foods.png	Contains 100% of your recommended daily allowance!			2016	12	19
1775	Things You Learn	things_you_learn.png	Guess who has two thumbs and spent the night in an ER after trying to rescue a kitten that ran under his car at a stoplight and climbed up into the engine compartment? And, thanks to antibiotics, will continue having two thumbs? THIS GUY. (P.S. kitten is safe!)			2016	12	21
1776	Reindeer	reindeer.png	And then in a twinkling, a sound gave me pause / From the roof came the scratching of eight tarsal claws.			2016	12	23
1777	Dear Diary	dear_diary.png	Dear Diary: UNSUBSCRIBE			2016	12	26
1778	Interest Timescales	interest_timescales.png	Sometimes, parts of a slowly-rising mountain suddenly rise REALLY fast, which is extra interesting.			2016	12	28
1779	2017	2017.png	Things are looking good for the eclipse--Nate Silver says Earth will almost definitely still have a moon in August.			2016	12	30
1780	Appliance Repair	appliance_repair.png	[holding up a three-phase motor] As you can see here, the problem is that the humidifier I took this from is broken.			2017	1	2
1781	Artifacts	artifacts.png	I didn't even realize you could HAVE a data set made up entirely of outliers.			2017	1	4
1782	Team Chat	team_chat.png	2078: He announces that he's finally making the jump from screen+irssi to tmux+weechat.			2017	1	6
1783	Emails	emails.png	Hey Rob, sorry it took me a while to get back to you! Sure, I'd love to see WALL-E opening weekend! Are you still doing that, or...?			2017	1	9
1784	Bad Map Projection: Liquid Resize	bad_map_projection_liquid_resize.png	This map preserves the shapes of Tissot's indicatrices pretty well, as long as you draw them in before running the resize.			2017	1	11
1785	Wifi	wifi.png	Further out to the right, it works correctly, but the reason it works still involves the word 'firmware.'			2017	1	13
1786	Trash	trash.png	Plus, time's all weird in there, so most of it probably broke down and decomposed hundreds of years ago. Which reminds me, I've been meaning to get in touch with Yucca Mountain to see if they're interested in a partnership.			2017	1	16
1787	Voice Commands	voice_commands.png	Dvorak words may sound hard to pronounce, but studies show they actually put less stress on the vocal cords.			2017	1	18
1788	Barge	barge.png	My life goal is to launch a barge into the air and have it land on one of Elon Musk's rockets.			2017	1	20
1789	Phone Numbers	phone_numbers.png	Texting should work. Unless the message is too long, in which case it gets converted to voicemails, and I think I'm locked out of my voicemail.			2017	1	23
1790	Sad	sad.png	With the right 90-degree rotation, any effect is a side effect.			2017	1	25
1791	Telescopes: Refractor vs Reflector	telescopes_refractor_vs_reflector.png	On the other hand, the refractor's limited light-gathering means it's unable to make out shadow people or the dark god Chernabog.			2017	1	27
1792	Bird/Plane/Superman	bird_plane_superman.png	You can apply special translucent films to your windows to help keep birds/Superman from accidentally flying into them.			2017	1	30
1793	Soda Sugar Comparisons	soda_sugar_comparisons.png	The key is portion control, which is why I've switched to eating smaller cans of frosting instead of full bottles.			2017	2	1
1794	Fire	fire.png	Billy Joel briefly detained			2017	2	3
