num	safe_title	img	alt	link	news	year	month	day
1795	All You Can Eat	all_you_can_eat.png	After my absent-mindedness resulted in a bad posterboard-related stomachache, I learned to do the sign-making place last.			2017	2	6
1796	Focus Knob	focus_knob.png	Maybe if I spin it back and forth really fast I can do some kind of pulse-width modulation.			2017	2	8
1797	Stardew Valley	stardew_valley.png	I have accidentally watered virtually every person and object in Pelican Town.			2017	2	10
1798	Box Plot	box_plot.png	You have to be careful doing this. Sometimes, when you push the whisker down, dynamite explodes.			2017	2	13
1799	Bad Map Projection: Time Zones	bad_map_projection_time_zones.png	This is probably the first projection in cartographic history that can be criticized for its disproportionate focus on Finland, Mongolia, and the Democratic Republic of the Congo.	https://imgs.xkcd.com/comics/bad_map_projection_time_zones_2x.png		2017	2	15
1800	Chess Notation	chess_notation.png	I've decided to score all my conversations using chess win-loss notation. (??)			2017	2	17
1801	Decision Paralysis	decision_paralysis.png	Good point--making no decision is itself a decision. So that's a THIRD option I have to research!			2017	2	20
1802	Phone	phone.png	[*disables social networking accounts*] [*social isolation increases*] Wait, why does this ALSO feel bad?			2017	2	22
1803	Location Reviews	location_reviews.png	Google and Yelp keep deleting my scathing reviews of the Mariana Trench, the Chernobyl reactor core, the jet stream, and the equator.			2017	2	24
1804	Video Content	video_content.png	"So, like, sexy news videos?" "No, people have tried that--it's still just video content. We need to actually inform people THROUGH making out. I would call it 'Mouth Content,' but I think that's already the title of a Neil Cicierega album."			2017	2	27
1805	Unpublished Discoveries	unpublished_discoveries.png	If you must know, I'm currently researching how to save this emailed tax form as a regular PDF so I can print and sign it. Our work isn't a lock for the Nobel, but we're in the running.			2017	3	1
1806	Borrow Your Laptop	borrow_your_laptop.png	If used with software that could keep up, a scroll wheel mapped to send a stream of 'undo' and 'redo' events could be kind of cool.			2017	3	3
1807	Listening	listening.png	Sure, you could just ask, but this also takes care of the host gift thing.			2017	3	6
1808	Hacking	hacking.png	The dump also contains a list of millions of prime factors, a 0-day Tamagotchi exploit, and a technique for getting gcc and bash to execute arbitrary code.			2017	3	8
1809	xkcd Phone 5	xkcd_phone_5.png	The phone will be collected by the toll operators and mailed back to you within 4-6 weeks.			2017	3	10
1810	Chat Systems	chat_systems.png	I'm one of the few Instagram users who connects solely through the Unix 'talk' gateway.			2017	3	13
1811	Best-Tasting Colors	best_tasting_colors.png	I recognize that chocolate is its own thing on which reasonable people may differ. Everything else here is objective fact.			2017	3	15
1812	Onboarding	onboarding.png	'So we just have a steady flow of metal piling up in our server room? Isn't that a problem?' 'Yeah, you should bring that up at our next bismuth meeting.'			2017	3	17
1813	Vomiting Emoji	vomiting_emoji.png	My favorite might be U+1F609 U+1F93F WINKING FACE VOMITING.			2017	3	20
1814	Color Pattern	color_pattern.png	♫ When the spacing is tight / And the difference is slight / That's a moiré ♫			2017	3	22
1815	Flag	flag.png	There's a compromise bill to keep the notification bar but at least charge the battery.			2017	3	24
1816	Mispronunciation	mispronunciation.png	I pronounce epitome "EPPY-tome", but EpiPen "uh-PIE-pen".			2017	3	27
1817	Incognito Mode	incognito_mode.png	They're really the worst tech support team. And their solutions are always the same. "This OS X update broke something." "LET'S INFILTRATE APPLE BY MORPHING APPLES!"			2017	3	29
1818	Rayleigh Scattering	rayleigh_scattering.png	If you ask "why are leaves green?" the usual answer is "because they're full of chlorophyll, and chlorophyll is green," even though "why does chlorophyll scatter green light?" is a great question too.			2017	3	31
1819	Sweet 16	sweet_16.png	Every year I make out my bracket at the season, and every year it's busted before the first game when I find out which teams are playing.			2017	4	3
1820	Security Advice	security_advice.png	Never give your password or bank account number to anyone who doesn't have a blue check mark next to their name.			2017	4	5
1821	Incinerator	incinerator.png	My trash can broke recently and I had to get rid of it. When I picked it up, I suffered a brief but harrowing existential crisis.			2017	4	7
1822	Existential Bug Reports	existential_bug_reports.png	ISSUE: If we wait long enough, the Earth will eventually be consumed by the Sun. WORKAROUND: None.			2017	4	10
1823	Hottest Editors	hottest_editors.png	Elon Musk finally blocked me from the internal Tesla repository because I wouldn't stop sending pull requests for my code supporting steering via vim keybindings.			2017	4	12
1824	Identification Chart	identification_chart.png	Be careful—it's breeding season, and some of these can be *extremely* defensive of their nests.			2017	4	14
1825	7 Eleven	7_eleven.png	Really, the only honest 24-hour stores are the ones in places like Arizona and Hawaii, and many of them are still wrong in certain years.			2017	4	17
1826	Birdwatching	birdwatching.png	No, tell the park rangers to calm down, it's fine--I put a screen on the front. I just want to get the birds a little closer.			2017	4	19
1827	Survivorship Bias	survivorship_bias.png	They say you can't argue with results, but what kind of defeatist attitude is that? If you stick with it, you can argue with ANYTHING.			2017	4	21
1828	ISS Solar Transit	iss_solar_transit.png	I guess it's also the right setting for pictures of the Moon at night.			2017	4	24
1829	Geochronology	geochronology.png	'The mountains near here formed when the ... Newfoundland ... microplate collided with, uhh ... Labrador.' 'Ok, now you're definitely just naming dogs.' 'Wait, no, that's actually almost correct.'			2017	4	26
1830	ISS Solar Transit 2	iss_solar_transit_2.png	Most people don't realize it, but they actually launch a new space station every few weeks because this keeps happening.		Previously: <a href="/1828/">ISS Solar Transit</a>	2017	4	28
1831	Here to Help	here_to_help.png	"We TOLD you it was hard." "Yeah, but now that I'VE tried, we KNOW it's hard."			2017	5	1
1832	Photo Library Management	photo_library_management.png	A good lifehack is to use messy and unstable systems to organize your photos. That way, every five years or so it becomes obsolete and/or collapses, and you have to open it up and pick only your favorite pictures to salvage.			2017	5	3
1833	Code Quality 3	code_quality_3.png	It's like a half-solved cryptogram where the solution is a piece of FORTH code written by someone who doesn't know FORTH.			2017	5	5
1834	Lunch Order	lunch_order.png	GO FOR LUNCH, REPEAT, GO FOR LUNCH.			2017	5	8
1835	Random Obsessions	random_obsessions.png	I take the view that "open-faced sandwiches" are not sandwiches, but all other physical objects are.			2017	5	10
1836	Okeanos	okeanos.png	WHEN I WAS ON A BOAT I DROPPED MY PHONE CAN U LOOK FOR IT			2017	5	12
1837	Rental Car	rental_car.png	Technically, both cars are haunted, but the murder ghosts can't stand listening to the broken GPS for more than a few minutes.			2017	5	15
1838	Machine Learning	machine_learning.png	The pile gets soaked with data and starts to get mushy over time, so it's technically recurrent.			2017	5	17
1839	Doctor Visit	doctor_visit.png	According to these blood tests, you're like 30% cereal.			2017	5	19
1840	Genetic Testing Results	genetic_testing_results.png	That's very exciting! The bad news is that it's a risk factor for a lot of things.			2017	5	22
1841	Who?	who.png	Gonna feel even dumber when I realize that all this time he's been talking into a bluetooth thingy and we're not actually friends.			2017	5	24
1842	Anti-Drone Eagles	anti_drone_eagles.png	It's cool, it's totally ethical--they're all programmed to hunt whichever bird of prey is most numerous at the moment, so they leave the endangered ones alone until near the end.			2017	5	26
1843	Opening Crawl	opening_crawl.png	Using a classic Timothy Zahn EU/Legends novel is bad enough, but at least the style and setting aren't too far off. If you really want to mess with people, try using Splinter of the Mind's Eye.			2017	5	29
1844	Voting Systems	voting_systems.png	Kenneth Arrow hated me because the ordering of my preferences changes based on which voting systems have what level of support. But it tells me a lot about the people I'm going to be voting with!			2017	5	31
1845	State Word Map	state_word_map.png	The top search for every state is PORN, except Florida, where it's SEX PORN.			2017	6	2
1846	Drone Problems	drone_problems.png	On the other hand, as far as they know, my system is working perfectly.			2017	6	5
1847	Dubious Study	dubious_study.png	Sounds fine. I looked up the Academy, and it says on their MySpace page that their journal is peer-viewed and downloaded biannually.			2017	6	7
1848	Glacial Erratic	glacial_erratic.png	"This will take a while, which sucks, because I'm already so busy chiseling out igneous intrusions from rock formations and watching Youtube loops of the Superman fault-sealing scene over and over."			2017	6	9
1849	Decades	decades.png	In the 90s, our variety radio station used the tagline "the best music of the 70s, 80s, and 90s." After 2000, they switched to "the best music of the 80s, 90s, and today." I figured they'd change again in 2010, but it's 2017 and they're still saying "80s, 90s, and today." I hope radio survives long enough for us to find out how they deal with the 2020s.			2017	6	12
1850	Air Force Museum	air_force_museum.png	I had fun visiting the museum at Dover Air Force Base, unless they don't have a museum, in which case I've never been to Delaware in my life.			2017	6	14
1851	Magnetohydrodynamics	magnetohydrodynamics.png	Magnetohydrodynamics combines the intuitive nature of Maxwell's equations with the easy solvability of the Navier-Stokes equations. It's so straightforward physicists add "relativistic" or "quantum" just to keep it from getting boring.			2017	6	16
1852	Election Map	election_map.png	Luckily for my interpretation, no precincts were won by the Green Party.			2017	6	19
1853	Once Per Day	once_per_day.png	I'm not totally locked into my routine—twice a year, I take a break to change the batteries in my smoke detectors.			2017	6	21
1854	Refresh Types	refresh_types.png	The hardest refresh requires both a Mac keyboard and a Windows keyboard as a security measure, like how missile launch systems require two keys to be turned at once.			2017	6	23
1855	Telephoto	telephoto.png	I was banned from the airliners.net photography forum by concerned moderators after the end of my lens started brushing against planes as they flew by.			2017	6	26
1856	Existence Proof	existence_proof.png	Real analysis is way realer than I expected.			2017	6	28
1857	Emoji Movie	emoji_movie.png	Some other studio should do the Antz/A Bug's Life thing and release The Dingbats Movie at the same time.			2017	6	30
1858	4th of July	4th_of_july.png	Strangely, they still celebrate by eating hot dogs. Since they don't have mouths, they just kinda toss them in the air and let them fall back down into their propeller blades. It's pretty messy.			2017	7	3
1859	Sports Knowledge	sports_knowledge.png	I heard they might make the wild card game, which would be cool. Do you know when that is? I have a wedding next weekend, but if it's after that we could try to go!			2017	7	5
1860	Communicating	communicating.png	You're saying that the responsibility for avoiding miscommunication lies entirely with the listener, not the speaker, which explains why you haven't been able to convince anyone to help you down from that wall.			2017	7	7
1861	Quantum	quantum.png	If you draw a diagonal line from lower left to upper right, that's the ICP 'Miracles' axis.			2017	7	10
1862	Particle Properties	particle_properties.png	Each particle also has a password which allows its properties to be changed, but the cosmic censorship hypothesis suggests we can never observe the password itself—only its secure hash.			2017	7	12
1863	Screenshots	screenshots.png	For the final exam, you take a screenshot showing off all the work you've done in the class, and it has to survive being uploaded, thumbnailed, and re-screenshotted through a chain of social media sites.			2017	7	14
1864	City Nicknames	city_nicknames.png	This place has so many demonyms. Northlanders. Fair Folk. Honey Barons. Lake Dwellers. Treasurers. Swamp Watchers. Dream Farmers. Wellfolk. Rockeaters. Forgotten Royals. Remote Clients. Barrow-Clerks. The People of Land and Sky.			2017	7	17
1865	Wifi vs Cellular	wifi_vs_cellular.png	According to the cable company reps who keep calling me, it's because I haven't upgraded to the XTREME GIGABAND PANAMAX FLAVOR-BLASTED PRO PACKAGE WITH HBO, which is only $5 more per month for the first 6 months and five billion dollars per month after that.			2017	7	19
1866	Russell's Teapot	russells_teapot.png	Unfortunately, NASA regulations state that Bertrand Russell-related payloads can only be launched within launch vehicles which do not launch themselves.			2017	7	21
1867	Physics Confession	physics_confession.png	"You know lightning, right? When electric charge builds up in a cloud and then discharges in a giant spark? Ask me why that happens." "Why does tha--" "No clue. We think it's related to the hair thing."			2017	7	24
1868	Eclipse Flights	eclipse_flights.png	The captain has turned on the 'fasten seat belt' sign.			2017	7	26
1869	Positive and Negative Reviews	positive_and_negative_reviews.png	This restaurant is great! I was feeling really sick, but then I ate there and felt better!			2017	7	28
1870	Emoji Movie Reviews	emoji_movie_reviews.png	There's this idea that emoji are bad for communication because they replace ambiguity and nuance with a limited set of preselected emotions, but it doesn't really survive a collision with real-world usage of the thinking face or upside-down smiley.			2017	7	31
1871	Bun Alert	bun_alert.png	Since buns range from crepuscular to nocturnal, it's recommended that you enable the scheduled "Do Not Disturb" mode on your phone to avoid being woken by alerts about Night Buns.			2017	8	2
1872	Backup Batteries	backup_batteries.png	If it falls below 20% full, my bag turns red and I start to panic.			2017	8	4
1873	Email Reply	email_reply.png	I would be honored, but I know I don't belong in your network. The person you invited was someone who had not yet inflicted this two-year ordeal upon you. I'm no longer that person.			2017	8	7
1874	Geologic Faults	geologic_faults.png	I live on a torn-bag-of-potato-chips-where-the-tear-is-rapidly-growing fault, which is terrifying.			2017	8	9
1875	Computers vs Humans	computers_vs_humans.png	It's hard to train deep learning algorithms when most of the positive feedback they get is sarcastic.			2017	8	11
1876	Eclipse Searches	eclipse_searches.png	There were traffic jams for the eclipses in 1970 and 1979, and that was *before* we had the potential for overnight viral social media frenzies.			2017	8	14
1877	Eclipse Science	eclipse_science.png	I was thinking of observing stars to verify Einstein's theory of relativity again, but I gotta say, that thing is looking pretty solid at this point.			2017	8	16
1878	Earth Orbital Diagram	earth_orbital_diagram.png	You shouldn't look directly at a partial eclipse because of the damage that can be caused by improperly aligning the solar-lunar orbital plane with the orbital bones around your eye.			2017	8	18
1879	Eclipse Birds	eclipse_birds.png	'Hey! Put her down!' 'No, it's ok! The next chance for me to be carried to a blood cauldron isn't until 2024!'			2017	8	21
1880	Eclipse Review	eclipse_review.png	I watched from a beautiful nature reserve in central Missouri, and it was--without exaggeration--the coolest thing I've ever seen.			2017	8	23
1881	Drone Training	drone_training.png	The joke will be on him in a few weeks when animal control shows up and takes custody of his Roomba.			2017	8	25
1882	Color Models	color_models.png	What if what *I* see as blue, *you* see as a slightly different blue because you're using Chrome instead of Firefox and despite a decade of messing with profiles we STILL can't get this right somehow.			2017	8	28
1883	Supervillain Plan	supervillain_plan.png	Someday, some big historical event will happen during the DST changeover, and all the tick-tock articles chronicling how it unfolded will have to include a really annoying explanation next to their timelines.			2017	8	30
1884	Ringer Volume/Media Volume	ringer_volume_media_volume.png	Our new video ad campaign has our product's name shouted in the first 500 milliseconds, so we can reach the people in adjacent rooms while the viewer is still turning down the volume.			2017	9	1
1885	Ensemble Model	ensemble_model.png	I'm in talks with Netflix to produce an alternate-universe crime drama about the world where sliced bread was never re-legalized, but it's going slowly because they keep changing their phone numbers and the door lock codes at their headquarters.			2017	9	4
1886	Typing Notifications	typing_notifications.png	Over the years I've decided I'd rather have them on than not, but I'm glad there aren't "has opened a blank note to compose a reply to you" notifications.			2017	9	6
1887	Two Down, One to Go	two_down_one_to_go.png	The third row will probably have to wait until 2034, and maybe longer. If I see a daytime supernova, I'll replace the meteor storm with that and consider it 3/3.			2017	9	8
1888	Still in Use	still_in_use.png	'Which one?' 'I dunno, it's your house. Just check each object.' 'Check it for *what*?' 'Whether it looks like it might have touched a paper towel at some point and then forgotten to let go.' '...' 'You can also Google to learn how to check which things are using which resources.' 'You know, I'll just leave the towel there and try again tomorrow.'			2017	9	11
1889	xkcd Phone 6	xkcd_phone_6.png	We understand your privacy concerns; be assured that our phones will never store or transmit images of your face.			2017	9	13
1890	What to Bring	what_to_bring.png	I always figured you should never bring a gun to a gun fight because then you'll be part of a gun fight.			2017	9	15
1891	Obsolete Technology	obsolete_technology.png	And I can't believe some places still use fax machines. The electrical signals waste so much time going AROUND the Earth when neutrino beams can go straight through!			2017	9	18
1892	USB Cables	usb_cables.png	Tag yourself, I'm "frayed."			2017	9	20
1893	Thread	thread.png	Since the current Twitter threadfall kicked off in early 2016, we can expect it to continue until the mid 2060s when the next Interval begins.			2017	9	22
1894	Real Estate	real_estate.png	I tried converting the prices into pizzas, to put it in more familiar terms, and it just became a hard-to-think-about number of pizzas.			2017	9	25
1895	Worrying Scientist Interviews	worrying_scientist_interviews.png	They always try to explain that they're called 'solar physicists', but the reporters interrupt with "NEVER MIND THAT, TELL US WHAT'S WRONG WITH THE SUN!"			2017	9	27
1896	Active Ingredients Only	active_ingredients_only.png	Contains the active ingredients from all competing cold medicines, plus the medicines for headaches, arthritis, insomnia, indigestion, and more, because who wants THOSE things?			2017	9	29
1897	Self Driving	self_driving.png	"Crowdsourced steering" doesn't sound quite as appealing as "self driving."			2017	10	2
1898	October 2017	october_2017.png	And yet I have no trouble believing that the start of the 2016 election was several decades ago.			2017	10	4
1899	Ears	ears.png	My theory is that most humans have been colonized with alien mind-control slugs that hold the earbuds for them, and the ones who can't wear earbuds are the only surviving free ones.			2017	10	6
1900	Jet Lag	jet_lag.png	I had some important research to do on proposed interstellar space missions, basketball statistics, canceled skyscrapers, and every article linked from "Women in warfare and the military in the 19th century."			2017	10	9
1901	Logical	logical.png	It's like I've always said--people just need more common sense. But not the kind of common sense that lets them figure out that they're being condescended to by someone who thinks they're stupid, because then I'll be in trouble.			2017	10	11
1902	State Borders	state_borders.png	A schism between the pro-panhandle and anti-panhandle factions eventually led to war, but both sides spent too much time working on their flag designs to actually do much fighting.			2017	10	13
1903	Bun Trend	bun_trend.png	Our experts have characterized the ecological impact of this trend as "adorable."			2017	10	16
1904	Research Risks	research_risks.png	The 1919 Great Boston Molasses Flood remained the deadliest confectionery containment accident until the Canadian Space Agency's 2031 orbital maple syrup delivery disaster.			2017	10	18
1905	Cast Iron Pan	cast_iron_pans.png	If you want to evenly space them, it's easiest to alternate between the Arctic and Antarctic. Some people just go to the Arctic twice, near the equinoxes so the visits are almost 6 months apart, but it's not the same.			2017	10	20
1906	Making Progress	making_progress.png	I started off with countless problems. But now I know, thanks to COUNT(), that I have "#REF! ERROR: Circular dependency detected" problems.			2017	10	23
1907	Immune System	immune_system.png	It also helps with negotiation. "Look, if it were up to me, *I'd* accept your offer, but my swarm of autonomous killer cells literally can't be reasoned with. It's out of my hands!"			2017	10	25
1908	Credit Card Rewards	credit_card_rewards.png	I should make a list of all the things I could be trying to optimize, prioritized by ... well, I guess there are a few different variables I could use. I'll create a spreadsheet ...			2017	10	27
1909	Digital Resource Lifespan	digital_resource_lifespan.png	I spent a long time thinking about how to design a system for long-term organization and storage of subject-specific informational resources without needing ongoing work from the experts who created them, only to realized I'd just reinvented libraries.			2017	10	30
1910	Sky Spotters	sky_spotters.png	Where I live, one of the most common categories of sky object without a weird obsessive spotting community is "lost birthday party balloons," so that might be a good choice—although you risk angering the marine wildlife people, and they have sharks.			2017	11	1
1911	Defensive Profile	defensive_profile.png	NO DRAMA ZONE -> If I've made you sad, you'd better not tell me, because I am TERRIFIED of that situation and have NO IDEA how to handle it.			2017	11	3
1912	Thermostat	thermostat.png	Your problem is so terrible, I worry that, if I help you, I risk drawing the attention of whatever god of technology inflicted it on you.			2017	11	6
1913	A �	i.png	If you want in on the fun, map a key on your keyboard to the sequence U+0041 U+0020 U+FFFD (or U+0021 U+0020 U+FFFD for the exclamation point version), and then no update can never take this away from you.			2017	11	8
1914	Twitter Verification	twitter_verification.png	When we started distributing special status tokens that signify which people are important enough to join an elite group, we never could have imagined we might be creating some problems down the line.			2017	11	10
1915	Nightmare Email Feature	nightmare_email_feature.png	"...just got back and didn't see your message until just now. Sorry! -- TIME THIS MESSAGE SAT HALF-FINISHED IN DRAFTS FOLDER: 3 days, 2 hours, 45 minutes."			2017	11	13
1916	Temperature Preferences	temperature_preferences.png	There's a supposed Mark Twain quote, "The coldest winter I ever spent was a summer in San Francisco." It isn't really by Mark Twain, but I don't know who said it—I just know they've never been to McMurdo Station.			2017	11	15
1917	How to Make Friends	how_to_make_friends.png	No, wait, come back! I want to be friends at you!			2017	11	17
1918	NEXUS	nexus.png	You also refuse to buy Cisco products because you hate the Thong Song, O. Henry, Deep Space Nine, freshwater whitefish, teenaged Incan emperors, Brak's brother, and vegetable-based shortening.			2017	11	20
1919	Interstellar Asteroid	interstellar_asteroid.png	Every time we detect an asteroid from outside the Solar System, we should immediately launch a mission to fling one of our asteroids back in the direction it came from.			2017	11	22
1920	Emoji Sports	emoji_sports.png	No horse has yet managed the elusive Quadruple Crown—winning the Kentucky Derby, the Preakness, the Belmont Stakes, and the Missouri Horse Hole.			2017	11	24
1921	The Moon and the Great Wall	the_moon_and_the_great_wall.png	And arguably sunspots, on rare occasions. But even if they count, it takes ideal conditions and you might hurt your eyes.			2017	11	27
1922	Interferometry	interferometry.png	It's important to note that while the effective size of the dog can be arbitrarily large, it's not any more of a good dog than the two original dogs.			2017	11	29
1923	Felsius	felsius.png	The symbol for degrees Felsius is an average of the Euro symbol (€) and the Greek lunate epsilon (ϵ).			2017	12	1
1924	Solar Panels	solar_panels.png	This works for a surprising range of sunlit things, including rooftops (sure), highway surfaces (probably not), sailboats (maybe), and jets, cars, and wild deer (haha good luck).			2017	12	4
1925	Self-Driving Car Milestones	self_driving_car_milestones.png	I'm working on a car capable of evaluating arbitrarily complex boolean expressions on "honk if [...]" bumper stickers and responding accordingly.			2017	12	6
