num	safe_title	img	alt	link	news	year	month	day
2781	The Six Platonic Solids	the_six_platonic_solids.png	Plato made the solids, and five were gifted to the mathematicians. But in secret Plato forged a sixth solid to rule over all the others.			2023	5	26
2782	Wikipedia Article Titles	wikipedia_article_titles.png	I would never stoop to vandalism, but I'm not above discreetly deleting the occasional 'this article contains excessive amounts of detail' tag.			2023	5	29
2783	Ruling Out	ruling_out.png	We were able to replicate and confirm prior authors' detection of a moon orbiting the Earth with high confidence.			2023	5	31
2784	Drainage Basins	drainage_basins.png	After a pail of water was thrown on the Wicked Witch of the West outside Salt Lake City, Utah's Great Salt Lake was measured to be 7 parts per trillion witch by volume.			2023	6	2
2785	Marble Run	marble_run.png	I have so many plans. It would incorporate a Galton board, a Ranque-Hilsch marble vortex tube, and a compartment lined with pinball bouncers with a camera-and-servo Maxwell's Demon that separated the balls into fast and slow sides.			2023	6	5
2786	UFO Evidence	ufo_evidence.png	[Decades in the future] "Well, the good news is that we've received definitive communication from aliens. The bad news is that they're asking about Cats (2019)."			2023	6	7
2787	Iceberg	iceberg.png	90% of the iceberg is hidden beneath the water, but that 90% only uses 10% of its brain, so it's really only 9%.			2023	6	9
2788	Musical Scales	musical_scales.png	In the Hall of the Mountain King was accidentally composed on log/log paper.			2023	6	12
2789	Making Plans	making_plans.png	Oh no, I haven't checked in with Yvonne in YEARS.			2023	6	14
2790	Heat Pump	heat_pump.png	If I'm not going to upgrade to a powered one, I should at LEAST stop leaving the door open so often.			2023	6	16
2791	Bookshelf Sorting	bookshelf_sorting.png	Of course, I sort all my bookshelves the normal way, alphabetically (by first sentence).			2023	6	19
2792	Summer Solstice	summer_solstice.png	Then I'll start work on my lunar engines to line the Moon up with the ecliptic so we can have a solar eclipse every month (with a little wobble so they're not always on the equator.)			2023	6	21
2793	Garden Path Sentence	garden_path_sentence.png	Arboretum Owner Denied Standing in Garden Path Suit on Grounds Grounds Appealing Appealing			2023	6	23
2794	Alphabet Notes	alphabet_notes.png	Listen, you're very cute, but if you rearrange the alphabet to put U and I together it will RUIN the spacing!			2023	6	26
2795	Glass-Topped Table	glass_topped_table.png	You can pour a drink into it while hosting a party, although it's a real pain to fit in the dishwasher afterward.			2023	6	28
2796	Real Estate Analysis	real_estate_analysis.png	Mars does get a good score on 'noise levels' and 'scenic views,' but the school district ranking isn't great; the only teacher--the Perseverance rover--is too busy with rock samples to teach more than the occasional weekend class.			2023	6	30
2797	Actual Progress	actual_progress.png	Slowly progressing from 'how do protons behave in relativistic collisions?' to 'what the heck are protons even doing when they're just sitting there?'			2023	7	3
2798	Room Temperature	room_temperature.png	They're also refusing to fund my device that demonstrates uncontrolled hot fusion.			2023	7	5
2799	Frankenstein Claim Permutations	frankenstein_claim_permutations.png	When I began trying to form a new claim by stitching together these parts in such an unnatural way, some called me mad.			2023	7	7
2800	Down	down.png	It's just that I get nervous about heights.			2023	7	10
2801	Contact Merge	contact_merge.png	I actually kind of feel like John and Surf King wouldn't like each other, which is a lot to unpack.			2023	7	12
2802	Fireflies	fireflies.png	I feel bad for Earth 2 and their shadowflies.			2023	7	14
2803	Geohydrotypography	geohydrotypography.png	The Atlantic is expanding at about 10 ppm (points per month).			2023	7	17
2804	Marshmallow	marshmallow.png	The increasing number of graham crackers and chocolate bars in orbit has created a growing risk of Kessler s'mores.			2023	7	19
2805	Global Atmospheric Circulation	global_atmospheric_circulation.png	Refs generally say that you can exercise enough altitude control to avoid the ground, but if you start strategically choosing air layers to steer yourself, that's traveling.			2023	7	21
2806	Anti-Vaxxers	anti_vaxxers.png	The vaccine stuff seems pretty simple. But if you take a closer look at the data, it's still simple, but bigger. And slightly blurry. Might need reading glasses.			2023	7	24
2807	Bad Map Projection: ABS(Longitude)	bad_map_projection_abs_longitude.png	Positive vibes/longitudes only			2023	7	26
2808	Daytime Firefly	daytime_firefly.png	Mr. Jones, watch out for Ms. Lenhart! She's from genus Photuris!			2023	7	28
2809	Moon	moon.png	I mean, it's pretty, but it doesn't really affect us beyond that. Except that half the nights aren't really dark, and once or twice a day it makes the oceans flood the coasts.			2023	7	31
2810	How to Coil a Cable	how_to_coil_a_cable.png	The ideal mix for maximum competitive cable-coiling energy is one A/V tech, one rock climber, one sailor, and one topologist.			2023	8	2
2811	Free Fallin'	free_fallin.png	Their crash investigation team had some particularly harsh words for Dave Matthews.			2023	8	4
2812	Solar Panel Placement	solar_panel_placement.png	Getting the utility people to run transmission lines to Earth is expensive, but it will pay for itself in no time.			2023	8	7
2813	What to Do	what_to_do.png	FYI: The 'drop, cover, and hold on' advice only applies to earthquakes. If you encounter a mountain lion, you should absolutely not drop to the ground, crawl under it, and hold on to one of its legs.			2023	8	9
2814	Perseids Pronunciation	perseids_pronunciation.png	When speaking out loud, you can can call it the 'Perseids meatier shower' and no one will ever know. (If you do get caught somehow, just tell them to Google the 'Kentucky meat shower' and that will distract them while you escape.)			2023	8	11
2815	Car Wash	car_wash.png	I'm glad modern car washes use synthetic baleen, instead of harvesting it from whales like 1800s car washes did.			2023	8	14
2816	Types of Solar Eclipse	types_of_solar_eclipse.png	The best place to be for a hug eclipse is a scenic natural area with good views and few clouds. The worst place to be is the lunar surface.			2023	8	16
2817	Electron Holes	electron_holes.png	They tried to report me to the authorities, but because I had the device they couldn't charge me.			2023	8	18
2818	Circuit Symbols	circuit_symbols.png	A circle with an A in it means that the circuit has committed a sin and has been marked as punishment.			2023	8	21
2819	Pronunciation	pronunciation.png	I pronounce the 'u' in 'pronunciation' like in 'putting' but the 'ou' in 'pronounce' like in 'wound'.			2023	8	23
2820	Inspiration	inspiration.png	An apple fell on Isaac Newton's head and gave him the idea that the moon might be a tasty apple, though this turned out not to be true--the Apollo program eventually determined that it was just a desolate and bland Red Delicious.			2023	8	25
2821	Path Minimization	path_minimization.png	Of course you get an ice cream cone for the swimmer too! You're not a monster.			2023	8	28
2822	*@gmail.com	gmail_com.png	Hi all, just replying to loop in *@outlook.com and *@yahoo.com.			2023	8	30
2823	Fossil	fossil.png	The two best reasons to get into fossils are booping trilobites and getting to say the word "fossiliferous" a lot.			2023	9	1
2824	Abstract Pickup	abstract_pickup.png	Escape Artist Frees Self From Conversation With Pickup Artist			2023	9	4
2825	Autumn and Fall	autumn_and_fall.png	Of course in reality this is just a US/UK thing; in British English, 'fall' is the brief period in between and 'autumn' is the main season.			2023	9	6
2826	Gold	gold.png	It can be expensive to hire a professional spectroscopist for your wedding, but the quality of the spectra you get is worth it.			2023	9	8
2827	Brassica	brassica.png	Sequoia Brussels sprouts are delicious but it's pretty hard to finish one.			2023	9	11
2828	Exoplanet Observation	exoplanet_observation.png	NASA prefers to say that their rovers are 'looking for signs of past life on Mars' and not 'ghost hunting.'			2023	9	13
2829	Iceberg Efficiency	iceberg_efficiency.png	Our experimental aerogel iceberg with helium pockets manages true 100% efficiency, barely touching the water, and it can even lift off of the surface and fly to more efficiently pursue fleeing hubristic liners.			2023	9	15
2830	Haunted House	haunted_house.png	You can leave at any time through the door over there. It's a Louisville door, so you'll need to find a compatible knob. No, don't be silly, that one is a Lexington knob! Of course it won't fit.			2023	9	18
2831	xkcd Phone Flip	xkcd_phone_flip.png	Theranos partnership: Sorry, we know, but we signed the contract back before all the stuff and the lawyers say we can't back out, so just try to keep your finger away from the bottom of the phone.			2023	9	20
2832	Urban Planning Opinion Progression	urban_planning_opinion_progression.png	If they're going to make people ride bikes and scooters in traffic, then it should at LEAST be legal to do the Snow Crash thing where you use a hook-shot-style harpoon to catch free rides from cars.			2023	9	22
2833	Lying	lying.png	I was, at least at the start of this disastrous game night, your friend.			2023	9	25
2834	Book Podcasts	book_podcasts.png	I've been working my way through this 1950s podcast by someone named John Tolkien called 'Lord of the Rings'--it's a deep dive into this fictional world he created. Good stuff, really bingeable!			2023	9	27
2835	Factorial Numbers	factorial_numbers.png	So what do we do when we get to base 10? Do we use A, B, C, etc? No: Numbers larger than about 3.6 million are simply illegal.			2023	9	29
2836	A Halloween Carol	a_halloween_carol.png	[after a minute] "Okay, I think I've got it, thanks. Can I--" "oOOOooOOooo!"			2023	10	2
2837	Odyssey	odyssey.png	Ugh, it says they attempted delivery but "Nobody was home."			2023	10	4
2838	Dubious Islands	dubious_islands.png	Running for office in Minnesota on the single-issue platform 'dig a permanent channel through the Traverse Gap because it will make this map more satisfying.'			2023	10	6
2839	Language Acquisition	language_acquisition.png	My first words were 'These were my first words; what were yours?'			2023	10	9
2840	Earth Layers	earth_layers.png	The Earth's magnetic field is primarily generated by currents in the liquid outer core, though some geophysicists argue that an unexplained mismatch with models suggests that the Kinder toy contains a magnet.			2023	10	11
2841	Sign Combo	sign_combo.png	Speed Limit: 45 MPH / Minimum: 65 MPH			2023	10	13
2842	Inspiraling Roundabout	inspiraling_roundabout.png	Look, I just think we need to stop coddling those hedonistic roundabout hogs who get into the inner lane and circle for hours, wasting valuable capacity.			2023	10	16
2843	Professional Oaths	professional_oaths.png	Interpretations of the Hermeneutic Oath differ.			2023	10	18
2844	Black Holes vs Regular Holes	black_holes_vs_regular_holes.png	Created by the collapse of: [massive stars] [Florida limestone bedrock]			2023	10	20
2845	Extinction Mechanisms	extinction_mechanisms.png	The Late Heavy Bombardment was followed a few billion years later by the Comparatively Light but Oddly Specific Bombardment.			2023	10	23
2846	Daylight Saving Choice	daylight_saving_choice.png	I average out the spring and fall changes and just set my clocks 39 minutes ahead year-round.			2023	10	25
2847	Dendrochronology	dendrochronology.png	These anomalies are known as Miyake events, named for the pioneering scientist who discovered them and was tragically devoured by a carnivorous tree.			2023	10	27
2848	Breaker Box	breaker_box.png	Any electrician will warn you to first locate and flip the house's CAUSALITY circuit breaker before touching the CIRCUIT BREAKERS one.			2023	10	30
2849	Under the Stars	under_the_stars.png	If you live in Los Angeles (around 33°52'N, roughly the latitude of Hermosa Beach) the black hole in V404 Cygni passes over you each day. On Christmas Day it will be directly overhead around 2pm.			2023	11	1
2850	Doctor's Office	doctors_office.png	"The police told me I can't be a doctor, but whenever they show up I just go into the Google Maps settings page I found and change the house to 'Police Headquarters' and then they have to do what I say."			2023	11	3
2851	Messier Objects	messier_objects.png	The debate over the correct Messier number for the Ship of Theseus is ongoing.			2023	11	6
2852	Parameterball	parameterball.png	The ball's density also varies, but players don't learn the value until after choosing their raquets. The infamous 'bowling ball table tennis' region of the parameter space often leads to equipment damage.			2023	11	8
2853	Redshift	redshift.png	So do you have any plans for z=-0.000000000000045?			2023	11	10
2854	Date Line	date_line.png	They estimate the rocket should be free by approximately ... uh ... well, in about two hours.			2023	11	13
2855	Empiricism	empiricism.png	The problems started with my resolution next year to reject temporal causality.			2023	11	15
2856	Materials Scientists	materials_scientists.png	If a materials scientist gives you a present, always ask whether regifting will incur any requirements for Federal paperwork.			2023	11	17
2857	Rebuttals	rebuttals.png	The mainstream dogma sparked a wave of dogmatic revisionism, and this revisionist mainstream dogmatism has now given way to a more rematic mainvisionist dogstream.			2023	11	20
2858	Thanksgiving Arguments	thanksgiving_arguments.png	An occasional source of mild Thanksgiving tension in my family is that my mother is a die-hard fan of The Core (2003), and various family members sometimes have differing levels of enthusiasm for her annual tradition of watching it.			2023	11	22
2859	Oceanography Gift	oceanography_gift.png	Shipping times vary. Same-ocean delivery may only take a few years, but delivery from the Weddell Sea in Antarctica may take multiple decades, and molecules meant for inland seas like the Mediterranean may be returned as undeliverable by surface currents.			2023	11	24
2860	Decay Modes	decay_modes.png	Unlike an Iron Age collapse, a Bronze Age collapse releases energy, since copper and tin are past the iron peak on the curve of binding energy.			2023	11	27
2861	X Value	x_value.png	The value of n is still unknown, but new results constrain it to fall between 8 and 10^500, ruling out popular 'n=1' and 'n=2' theories.			2023	11	29
2862	Typical Seating Chart	typical_seating_chart.png	Now that airlines have started adding wheel locks to their drink carts, less than half of flights have one accidentally fall out through the hole.			2023	12	1
2863	Space Typography	space_typography.png	And over heeee[...]eeeere (i)s Saturn.			2023	12	4
2864	Compact Graphs	compact_graphs.png	People may complain about readability, but even with jpeg compression, extracting the data points is usually computationally feasible if there aren't too many of them.			2023	12	6
2865	The Wrong Stuff	the_wrong_stuff.png	The phantom found Edward Everett Hale a century too early; by the time we invented satellites, the specifics of his 'brick moon' proposal were dismissed as science fiction.			2023	12	8
2866	Snow	snow.png	For someone who has ostensibly outgrown staying up late waiting for Santa, I do spend an awful lot of time refreshing websites to see if packages are here yet.			2023	12	11
2867	DateTime	datetime.png	It's not just time zones and leap seconds. SI seconds on Earth are slower because of relativity, so there are time standards for space stuff (TCB, TGC) that use faster SI seconds than UTC/Unix time. T2 - T1 = [God doesn't know and the Devil isn't telling.]			2023	12	13
2868	Label the States	label_the_states.png	Even with a blank map, a lot of people can only name 45-50 of the 64 states.			2023	12	15
2869	Puzzles	puzzles.png	Why couldn't the amulet have been hidden by Aunt Alice, who understands modern key exchange algorithms?			2023	12	18
2870	Love Songs	love_songs.png	The Piña Colada song carves a trajectory across the chart over the course of the song.			2023	12	20
2871	Definitely	definitely.png	A really mean prank you can play on someone who's picky about words is to add a 'definitely->definitively' autocorrect rule to their keyboard.			2023	12	22
2872	Hydrothermal Vents	hydrothermal_vents.png	Benthic Santas weren't even discovered until the 1970s, but many scientists now believe Christmas may have originally developed around hydrothermal vents and only later migrated to the surface.			2023	12	25
2873	Supersymmetry	supersymmetry.png	High-speed collisions at the Baby Park track may support the hypothesis that Daisy is her own evil twin, a theory first suggested by Nintendo in the game Majorana's Mask.			2023	12	27
2874	Iceland	iceland.png	The HVAC bill for installing the Gulf Stream was enormous.			2023	12	29
2875	2024	2024.png	It wasn't originally constitutionally required, but presidents who served two terms have traditionally followed George Washington's example and gotten false teeth.			2024	1	1
2876	Range Safety	range_safety.png	The Range Mischief Officer has modified the trajectory to add a single random spin somewhere in the flight, but won't tell us where.			2024	1	3
2877	Fever	fever.png	Hypothermia of below 98.6 K should be treated by leaving the giant molecular cloud and moving to the vicinity of a star.			2024	1	5
2878	Supernova	supernova.png	They're a little cagey about exactly where the crossover point lies relative to the likelihood of devastating effects on the planet.			2024	1	8
2879	Like This One	like_this_one.png	A lot of sentences undergo startling shifts in mood if you add 'like this one' to the end, but high on the list is 'I'm a neurologist studying dreams.'			2024	1	10
2880	Sheet Bend	sheet_bend.png	A left-handed sheet bend creates a much weaker connection, especially under moderate loads.			2024	1	12
2881	Bug Thread	bug_thread.png	After some account issues, we've added 6 new people from the beach house rental website support forum.			2024	1	15
2882	Net Rotations	net_rotations.png	For decades I've been working off the accumulated rotation from one long afternoon on a merry-go-round when I was eight.			2024	1	17
2883	Astronaut Guests	astronaut_guests.png	They didn't bring us a gift, but considering the kinetic energy of a bottle of wine at orbital speed, that's probably for the best.			2024	1	19
2884	Log Alignment	log_alignment.png	A video can have a log scale that's misaligned with both the time AND space axes.			2024	1	22
2885	Spelling	spelling.png	Any time I misspell a word it's just because I have too much integrity to copy answers from the dictionary.			2024	1	24
2886	Fast Radio Bursts	fast_radio_bursts.png	Dr. Petroff has also shown that the Higgs boson signal was actually sparks from someone microwaving grapes, the EHT black hole photo was a frozen bagel someone left in too long, and the LIGO detection was just someone slamming the microwave door too hard.			2024	1	26
2887	Minnesota	minnesota.png	In addition to 'squishy', after reviewing my submitted intraplate ground motion data, the National Geodetic Survey has politely asked me to stop using the word 'supple' so often when describing Midwestern states.			2024	1	29
2888	US Survey Foot	us_survey_foot.png	Subway refuses to answer my questions about whether it's an International Footlong or a US Survey Footlong. A milligram of sandwich is at stake!			2024	1	31
2889	Greenhouse Effect	greenhouse_effect.png	Once he had the answer, Arrhenius complained to his friends that he'd "wasted over a full year" doing tedious calculations by hand about "so trifling a matter" as hypothetical CO2 concentrations in far-off eras (quoted in Crawford, 1997).			2024	2	2
2890	Relationship Advice	relationship_advice.png	Good to be a little wary of advice that sounds too much like a self pep talk.			2024	2	5
2891	Log Cabin	log_cabin.png	I'm sure the building inspectors will approve my design once they finally manage to escape.			2024	2	7
2892	Banana Prices	banana_prices.png	It's a linear extrapolation, Michael. How big could the error be? 10%?			2024	2	9
2893	Sphere Tastiness	sphere_tastiness.png	Baseballs do present a challenge to this theory, but I'm convinced we just haven't found the right seasoning.			2024	2	12
2894	Research Account	research_account.png	Focus of your research: EXTREME PETTINESS AND UNWILLINGNESS TO LET ANYTHING GO			2024	2	14
2895	Treasure Chests	treasure_chests.png	[earlier] "Your vintage-style handmade chest business is struggling. But I have a plan."			2024	2	16
2896	Crossword Constructors	crossword_constructors.png	Also, we would really appreciate it if you could prominently refer to it as an 'eHit'.			2024	2	19
2897	Light Leap Years	light_leap_years.png	When Pope Gregory XIII briefly shortened the light-year in 1582, it led to navigational chaos and the loss of several Papal starships.			2024	2	21
2898	Orbital Argument	orbital_argument.png	"Some people say light is waves, and some say it's particles, so I bet light is some in-between thing that's both wave and particle depending on how you look at it. Am I right?" "YES, BUT YOU SHOULDN'T BE!"			2024	2	23
2899	Goodhart's Law	goodharts_law.png	[later] I'm pleased to report we're now identifying and replacing hundreds of outdated metrics per hour.			2024	2	26
2900	Call My Cell	call_my_cell.png	'Hey, can you call my cell?' '...I'm trying, but it says this number is blocked?' 'Ok, thanks, just checking.'			2024	2	28
2901	Geographic Qualifiers	geographic_qualifiers.png	'Thank you for the loveliest evening I've ever had...' [normal] '...east of the Mississippi.' [instant intrigue!]			2024	3	1
2902	Ice Core	ice_core.png	If you find an ash deposition layer from a year in which an eruption destroyed an island that had Camellia sinensis growing on it, you can make a Gone Island Ice_τ.			2024	3	4
2903	Earth/Venus Venn Diagram	earth_venus_venn_diagram.png	Actually, the fact that Mars is still orbiting safely over here means that it was technically an *Euler* apocalypse, not a Venn one.			2024	3	6
2904	Physics vs. Magic	physics_vs_magic.png	'At the stroke of midnight, your brother will be hurtling sideways at an altitude of 150 meters' is a regular physics prediction about your nonmagical trebuchet, whereas 'you are cursed to build a brother-launching trebuchet' falls out of the Lagrangian.			2024	3	8
2905	Supergroup	supergroup.png	I love their cover of 1,200 Balloons, Dalmatians, and Miles.			2024	3	11
2906	Earth	earth.png	Just think of all the countless petty squabbles and misunderstandings, of all the fervent hatreds, over so insignificant a thing as the direction and duration of a rocket engine firing.			2024	3	13
2907	Schwa	schwa.png	Doug's cousin, the one from London, runs a Bumble love cult.			2024	3	15
2908	Moon Armor Index	moon_armor_index.png	Astronomers are a little unsure of the applicability of this index, but NASA's Planetary Protection Officer is all in favor.			2024	3	18
2909	Moon Landing Mission Profiles	moon_landing_mission_profiles.png	If you pick a low enough orbit, it gives you a lot of freedom to use a lightweight launch vehicle such as a stepladder.			2024	3	20
2910	The Wreck of the Edmund Fitzgerald	the_wreck_of_the_edmund_fitzgerald.png	You know that asteroid that almost destroyed Earth in the 90s? Turns out the whole thing was secretly created by Michael Bay, who then PAID Bruce Willis and Ben Affleck to look heroic while blowing it up!			2024	3	22
2911	Greenland Size	greenland_size.png	The Mercator projection drastically distorts the size of almost every area of land except a small ring around the North and South Poles.			2024	3	25
2912	Cursive Letters	cursive_letters.png	𝓘 𝓽𝓱𝓲𝓷𝓴 𝓬𝓪𝓹𝓲𝓽𝓪𝓵 𝓛 𝓲𝓼 𝓹𝓻𝓸𝓫𝓪𝓫𝓵𝔂 𝓽𝓱𝓮 𝓶𝓸𝓼𝓽 𝓯𝓾𝓷 𝓽𝓸 𝔀𝓻𝓲𝓽𝓮, 𝓽𝓱𝓸𝓾𝓰𝓱 𝓵𝓸𝔀𝓮𝓻𝓬𝓪𝓼𝓮 𝓺 𝓲𝓼 𝓪𝓵𝓼𝓸 𝓪 𝓼𝓽𝓻𝓸𝓷𝓰 𝓬𝓸𝓷𝓽𝓮𝓷𝓭𝓮𝓻.			2024	3	27
2913	Periodic Table Regions	periodic_table_regions.png	Cesium-133, let it be. Cesium-134, let it be even more.			2024	3	29
2914	Eclipse Coolness	eclipse_coolness.png	A partial eclipse is like a cool sunset. A total eclipse is like someone broke the sky.			2024	4	1
2915	Eclipse Clouds	eclipse_clouds.png	The rare compound solar-lunar-nephelogical eclipse			2024	4	3
2916	Machine	machine.png	The Credible Machine		Today's comic was created with <a href="https://chromakode.com">Max Goodhart</a>, <a href="https://github.com/spyhi">Ed White</a>, <a href="https://twitter.com/uh_oh_thats_bad">Alex Garcia</a>, <a href="https://twitter.com/cotrone">Kevin Cotrone</a>, <a href="http://burningcandle.io/">Conor &amp; Ami Stokes</a>, <a href="https://liranuna.com">Liran Nuna</a>, <a href="https://www.instagram.com/fading_interest/">Patrick</a>, <a href="https://manishearth.github.io">Manish Goregaokar</a>, <a href="https://github.com/benley">Benjamin Staffin</a>, <a href="https://github.com/ayust">Amber</a>, and <a href="https://github.com/dyfrgi">Michael Leuchtenburg</a> with physics by <a href="https://rapier.rs">Rapier</a>.	2024	4	5
2917	Types of Eclipse Photo	types_of_eclipse_photo.png	The most rare, top-tier eclipse photo would be the Solar Earth Eclipse, but the Apollo 12 crew's attempt to capture it was marred by camera shake. They said it looked spectacular, though.			2024	4	8
2918	Tick Marks	tick_marks.png	If you're really savvy, you can hide an entire set of illicit transactions by timing them to draw what looks like a graph inset.			2024	4	10
2919	Sitting in a Tree	sitting_in_a_tree.png	First comes blood / Then we perish / Then comes Death in his Eternity Carriage.			2024	4	12
